{
  "version": 2,
  "manifestType": "crypto-agility",
  "generatedAt": "2026-10-11T10:00:00Z",
  "expiresAt": "2026-10-12T10:00:00Z",
  "subject": {
    "kind": "origin",
    "id": "https://example.org"
  },
  "observations": [],
  "migration": [],
  "profiles": [
    {
      "id": "service",
      "endpointRole": "server",
      "deviceClass": "server",
      "protocol": "TLS 1.3",
      "keyEstablishment": [],
      "authentication": [],
      "fallback": "unknown"
    }
  ]
}
